{
  "task_id": "task-F2D72004",
  "created_at": "2026-04-15T19:04:47Z",
  "branch_name": "task/task-F2D72004/revise-planner-prompt-to-enforce-rule-based-struct",
  "estimated_complexity": "medium",
  "notes": "Ensure that the planner prompt is updated to include a strict rule about test command usage, enforcing 'python -m pytest' and forbidding 'pytest' alone.",
  "steps": [
    {
      "step_id": 1,
      "description": "Locate the planner prompt definition file",
      "action_type": "research",
      "target": "planner prompt definition file location",
      "details": "Identify the file where the planner prompt is defined. This is typically a configuration or script file within the AI orchestration pipeline."
    },
    {
      "step_id": 2,
      "description": "Open the planner prompt definition file",
      "action_type": "modify_file",
      "target": "path/to/planner_prompt_definition_file",
      "details": "Open the identified file in a text editor to make modifications to the planner prompt."
    },
    {
      "step_id": 3,
      "description": "Add rule for test command usage in planner prompt",
      "action_type": "modify_file",
      "target": "path/to/planner_prompt_definition_file",
      "details": "Within the planner prompt, add a rule that explicitly states: 'All test commands MUST use 'python -m pytest'. The use of 'pytest' alone is forbidden. If a command violates this rule, it must be regenerated until it complies.' Ensure this rule is clearly defined and integrated into the prompt's rule-based structure."
    },
    {
      "step_id": 4,
      "description": "Save changes to the planner prompt definition file",
      "action_type": "modify_file",
      "target": "path/to/planner_prompt_definition_file",
      "details": "After adding the new rule, save the changes to ensure the planner prompt is updated with the new requirements."
    },
    {
      "step_id": 5,
      "description": "Verify the planner prompt enforces the new rule",
      "action_type": "run_command",
      "target": "python -m pytest tests/test_planner_prompt.py",
      "details": "Run the test suite associated with the planner prompt to verify that the new rule is enforced. Ensure that any test commands generated by the planner use 'python -m pytest' and that 'pytest' alone is not used."
    }
  ]
}