{
  "task_id": "task-64ED3B8D",
  "created_at": "2026-04-15T14:25:07Z",
  "branch_name": "task/task-64ED3B8D/implement-environment-self-healing-in-executor",
  "estimated_complexity": "medium",
  "notes": "Ensure that the self-healing logic is implemented in a way that it can be easily extended or modified in the future if needed.",
  "steps": [
    {
      "step_id": 1,
      "description": "Identify the function responsible for executing shell commands in the executor",
      "action_type": "research",
      "target": "executor command execution function",
      "details": "Locate the function in the executor codebase that is responsible for executing shell commands. This function will be modified to include the self-healing logic."
    },
    {
      "step_id": 2,
      "description": "Modify the command execution function to detect missing dependencies",
      "action_type": "modify_file",
      "target": "path/to/executor_file.py",
      "details": "Add logic to the command execution function to detect when a command fails due to a missing dependency. This can be done by checking the error message for common patterns indicating missing packages."
    },
    {
      "step_id": 3,
      "description": "Implement logic to install missing dependencies",
      "action_type": "modify_file",
      "target": "path/to/executor_file.py",
      "details": "Within the command execution function, implement logic to parse the error message, extract the missing package name, and execute 'python -m pip install <package>'. Ensure this is done only once per command failure."
    },
    {
      "step_id": 4,
      "description": "Add retry logic for the failed command",
      "action_type": "modify_file",
      "target": "path/to/executor_file.py",
      "details": "After attempting to install the missing dependency, retry the original command once. Ensure that if the command fails again, it does not enter an infinite loop."
    },
    {
      "step_id": 5,
      "description": "Implement error handling for failed installations",
      "action_type": "modify_file",
      "target": "path/to/executor_file.py",
      "details": "Add error handling logic to provide a clear error message if the installation of the missing dependency fails. This message should indicate the failure and suggest possible manual resolution steps."
    },
    {
      "step_id": 6,
      "description": "Test the self-healing logic with various scenarios",
      "action_type": "run_command",
      "target": "pytest tests/executor_self_healing_tests.py",
      "details": "Create and run tests to ensure the self-healing logic works as expected. Test scenarios should include a missing dependency, successful installation, failed installation, and command retry behavior."
    }
  ]
}