{
  "task_id": "task-TEST0001",
  "created_at": "2026-04-14T20:10:42Z",
  "branch_name": "task/task-TEST0001/generate-a-readme-for-system-architecture-and-usag",
  "estimated_complexity": "medium",
  "notes": "Ensure that the README does not include any proprietary or sensitive information. Focus on clarity and completeness in each section.",
  "steps": [
    {
      "step_id": 1,
      "description": "Create README.md file",
      "action_type": "create_file",
      "target": "README.md",
      "details": "Create a new README.md file in the root directory of the repository. This file will contain sections for system architecture, workflow, and usage instructions."
    },
    {
      "step_id": 2,
      "description": "Document system architecture in README.md",
      "action_type": "document",
      "target": "README.md",
      "details": "Add a section titled 'System Architecture' in the README.md. Provide a high-level overview of the system's components and their interactions. Use diagrams if necessary, but ensure they are described in text for accessibility."
    },
    {
      "step_id": 3,
      "description": "Document system workflow in README.md",
      "action_type": "document",
      "target": "README.md",
      "details": "Add a section titled 'Workflow' in the README.md. Describe the typical flow of operations within the system, including key processes and data flow. Ensure the description is clear and logically ordered."
    },
    {
      "step_id": 4,
      "description": "Document usage instructions in README.md",
      "action_type": "document",
      "target": "README.md",
      "details": "Add a section titled 'Usage Instructions' in the README.md. Provide step-by-step instructions on how to set up and use the system. Include any prerequisites, installation steps, and example commands. Ensure the instructions are easy to follow."
    },
    {
      "step_id": 5,
      "description": "Format README.md in Markdown",
      "action_type": "modify_file",
      "target": "README.md",
      "details": "Review the README.md to ensure it is correctly formatted in Markdown. Use headings, lists, and code blocks where appropriate to enhance readability. Verify that all sections are clearly delineated and that the document meets Markdown standards."
    }
  ]
}