{
  "task_id": "task-1F56C8CA",
  "created_at": "2026-04-15T11:31:11Z",
  "branch_name": "task/task-1F56C8CA/enhance-the-clarity-and-structure-of-the-readme",
  "estimated_complexity": "medium",
  "notes": "Ensure that the README maintains its original intent while enhancing clarity and structure.",
  "steps": [
    {
      "step_id": 1,
      "description": "Review the current README.md for existing content and structure",
      "action_type": "research",
      "target": "README.md",
      "details": "Open the README.md file and carefully read through its content to understand the existing sections, information, and overall structure. Note any areas that are unclear or poorly structured."
    },
    {
      "step_id": 2,
      "description": "Identify areas for improvement in clarity and structure",
      "action_type": "research",
      "target": "README.md",
      "details": "Based on the review, list specific areas where the README can be improved in terms of clarity, readability, and structure. Consider the flow of information and the use of headings."
    },
    {
      "step_id": 3,
      "description": "Revise the README.md to enhance clarity",
      "action_type": "modify_file",
      "target": "README.md",
      "details": "Edit the README.md to improve clarity. Rewrite sentences that are unclear, use simpler language where possible, and ensure that the information is presented in a straightforward manner. Maintain the original intent of the content."
    },
    {
      "step_id": 4,
      "description": "Organize the README.md content into a logical structure",
      "action_type": "modify_file",
      "target": "README.md",
      "details": "Reorganize the content of the README.md to follow a logical structure. Use appropriate headings and subheadings to break down the content into sections. Ensure that the flow of information is logical and easy to follow for a new user."
    },
    {
      "step_id": 5,
      "description": "Proofread the README.md for grammatical and spelling errors",
      "action_type": "modify_file",
      "target": "README.md",
      "details": "Carefully proofread the README.md to correct any grammatical or spelling errors. Ensure that the document is polished and meets production-quality standards."
    }
  ]
}