{
  "task_id": "task-6C5C989C",
  "created_at": "2026-04-15T12:40:55Z",
  "branch_name": "task/task-6C5C989C/enhance-reviewer-to-enforce-strict-quality-standar",
  "estimated_complexity": "medium",
  "notes": "Ensure that the reviewer logic is updated to include all specified checks and that it provides detailed feedback for revisions.",
  "steps": [
    {
      "step_id": 1,
      "description": "Identify the current reviewer logic implementation",
      "action_type": "research",
      "target": "reviewer logic codebase",
      "details": "Locate the files and functions where the reviewer logic is currently implemented. This will likely involve searching for keywords like 'approve', 'review', and 'feedback' in the codebase."
    },
    {
      "step_id": 2,
      "description": "Modify reviewer logic to include strict quality checks",
      "action_type": "modify_file",
      "target": "path/to/reviewer_logic_file.ext",
      "details": "Update the reviewer logic to include checks for task completeness, clarity, differentiation, and limitations. Ensure that the logic does not approve tasks unless all criteria are met. Implement a mechanism to return 'revise' with specific instructions if any criteria are not met."
    },
    {
      "step_id": 3,
      "description": "Implement detailed feedback mechanism",
      "action_type": "modify_file",
      "target": "path/to/reviewer_logic_file.ext",
      "details": "Enhance the feedback mechanism to provide specific revision instructions. Ensure that the feedback clearly indicates what is missing or weak in the task submission and how it can be improved."
    },
    {
      "step_id": 4,
      "description": "Test the updated reviewer logic",
      "action_type": "run_command",
      "target": "run tests for reviewer logic",
      "details": "Execute the test suite associated with the reviewer logic to ensure that the new checks and feedback mechanisms work as expected. Pay special attention to cases where tasks should be approved versus those that should be returned for revision."
    },
    {
      "step_id": 5,
      "description": "Document the changes made to the reviewer logic",
      "action_type": "document",
      "target": "docs/reviewer_logic_changes.md",
      "details": "Create a documentation file that outlines the changes made to the reviewer logic. Include details on the new quality standards, the checks implemented, and examples of feedback provided for revisions. Ensure the tone is technical and the document is clear and concise."
    }
  ]
}