{
  "task_id": "task-6C5A7B4D",
  "created_at": "2026-04-15T18:40:58Z",
  "branch_name": "task/task-6C5A7B4D/enhance-planner-to-adapt-plans-based-on-execution-",
  "estimated_complexity": "high",
  "notes": "This task involves modifying the core logic of the planner to handle execution failures dynamically, which requires careful design to ensure backward compatibility and maintain existing functionalities.",
  "steps": [
    {
      "step_id": 1,
      "description": "Research existing planner logic for handling execution failures",
      "action_type": "research",
      "target": "planner execution failure handling",
      "details": "Review the current implementation of the planner to understand how it processes execution failures and identify areas where adaptive logic can be integrated."
    },
    {
      "step_id": 2,
      "description": "Design adaptive logic for handling failed run_command steps",
      "action_type": "document",
      "target": "docs/planner_adaptive_logic.md",
      "details": "Create a detailed design document outlining the logic for analyzing failed run_command steps and adapting the plan. Include decision-making criteria for modifying or replacing steps, and strategies to prevent identical plans across revisions."
    },
    {
      "step_id": 3,
      "description": "Implement adaptive logic in the planner codebase",
      "action_type": "modify_file",
      "target": "src/planner.py",
      "details": "Modify the planner's code to integrate the adaptive logic designed in the previous step. Ensure that the planner can analyze execution failures and adapt plans by modifying or replacing failed run_command steps."
    },
    {
      "step_id": 4,
      "description": "Develop mechanism to prevent identical plans across revisions",
      "action_type": "modify_file",
      "target": "src/planner.py",
      "details": "Implement a mechanism within the planner to track and compare previous plans, ensuring that identical plans are not generated across revisions. This may involve storing a history of plans and implementing checks before generating a new plan."
    },
    {
      "step_id": 5,
      "description": "Write unit tests for adaptive logic and plan uniqueness",
      "action_type": "create_file",
      "target": "tests/test_planner_adaptive_logic.py",
      "details": "Create unit tests to verify that the planner correctly adapts plans based on execution failures and does not generate identical plans across revisions. Ensure tests cover various scenarios and edge cases."
    },
    {
      "step_id": 6,
      "description": "Run tests to validate new planner functionalities",
      "action_type": "run_command",
      "target": "pytest tests/test_planner_adaptive_logic.py",
      "details": "Execute the unit tests to ensure that the new adaptive logic and plan uniqueness mechanisms work as intended. Verify that the planner maintains its original functionality without regression issues."
    },
    {
      "step_id": 7,
      "description": "Document changes and update planner documentation",
      "action_type": "modify_file",
      "target": "docs/planner_overview.md",
      "details": "Update the planner's documentation to include information about the new adaptive logic and mechanisms to prevent identical plans. Ensure the documentation is clear and provides guidance on how the new features work."
    }
  ]
}