{
  "task_id": "task-6BE862AC",
  "created_at": "2026-04-15T14:40:21Z",
  "branch_name": "task/task-6BE862AC/create-and-test-python-file-with-missing-dependenc",
  "estimated_complexity": "medium",
  "notes": "Ensure that the Python file and test are simple enough to clearly demonstrate the missing dependency issue and its resolution.",
  "steps": [
    {
      "step_id": 1,
      "description": "Create a Python file with a function that uses an external library",
      "action_type": "create_file",
      "target": "example.py",
      "details": "Create a Python file named 'example.py' with a function that uses the 'requests' library to fetch data from a URL. The function should be simple, such as 'def fetch_data(url): return requests.get(url).text'."
    },
    {
      "step_id": 2,
      "description": "Create a pytest test file that tests the function in example.py",
      "action_type": "create_file",
      "target": "test_example.py",
      "details": "Create a pytest test file named 'test_example.py'. Write a test function 'def test_fetch_data()' that calls 'fetch_data' with a sample URL and checks if the result is not None. This test should fail due to the missing 'requests' library."
    },
    {
      "step_id": 3,
      "description": "Run pytest to execute the test and confirm it fails due to missing dependency",
      "action_type": "run_command",
      "target": "pytest test_example.py",
      "details": "Run the command 'pytest test_example.py' in the terminal. Observe the output to confirm that the test fails because the 'requests' library is not installed."
    },
    {
      "step_id": 4,
      "description": "Install the missing 'requests' library using pip",
      "action_type": "run_command",
      "target": "pip install requests",
      "details": "Execute the command 'pip install requests' in the terminal to install the missing 'requests' library."
    },
    {
      "step_id": 5,
      "description": "Rerun pytest to ensure the test passes after installing the dependency",
      "action_type": "run_command",
      "target": "pytest test_example.py",
      "details": "Run the command 'pytest test_example.py' again in the terminal. Verify that the test now passes successfully."
    },
    {
      "step_id": 6,
      "description": "Document the process in a Markdown file",
      "action_type": "document",
      "target": "PROCESS.md",
      "details": "Create a Markdown file named 'PROCESS.md'. Document the entire process including the initial test failure, detection of the missing dependency, installation of the dependency, and the successful test result. Ensure clarity and include command outputs where relevant."
    }
  ]
}