{
  "task_id": "task-7E7461D5",
  "created_at": "2026-04-15T11:37:41Z",
  "branch_name": "task/task-7E7461D5/review-and-enhance-readme-md-for-production-grade-",
  "estimated_complexity": "medium",
  "notes": "Ensure that the README.md remains concise and under 2000 words while addressing all identified issues.",
  "steps": [
    {
      "step_id": 1,
      "description": "Review the current README.md for weaknesses and gaps",
      "action_type": "research",
      "target": "current README.md content",
      "details": "Critically analyze the current README.md to identify any weaknesses, gaps, unclear areas, and missing sections. Take notes on areas that need improvement or additional content."
    },
    {
      "step_id": 2,
      "description": "Determine essential sections for production-grade documentation",
      "action_type": "research",
      "target": "essential sections for production-grade README",
      "details": "Research best practices for production-grade README.md files. Identify sections that are commonly included, such as installation instructions, usage examples, contribution guidelines, and FAQs."
    },
    {
      "step_id": 3,
      "description": "Enhance README.md with identified improvements",
      "action_type": "modify_file",
      "target": "README.md",
      "details": "Incorporate the identified improvements into the README.md. Add any missing sections, clarify unclear areas, and address weaknesses. Ensure the document includes clear differentiation, limitations, and real-world usage clarity while keeping it under 2000 words."
    }
  ]
}