{
  "task_id": "task-C3B27332",
  "created_at": "2026-04-15T19:53:52Z",
  "branch_name": "task/task-C3B27332/enforce-plan-validation-before-command-execution",
  "estimated_complexity": "medium",
  "notes": "",
  "steps": [
    {
      "step_id": 1,
      "description": "Create a wrapper function for command execution",
      "action_type": "create_file",
      "target": "execution_wrapper.py",
      "details": "import logging\nfrom validate_plan import validate_plan\n\nlogging.basicConfig(level=logging.INFO)\n\ndef execute_command(command):\n    if validate_plan(command):\n        logging.info(f'Command validated: {command}')\n        # Here you would normally execute the command\n        # e.g., subprocess.run(command, shell=True)\n        logging.info(f'Executing command: {command}')\n    else:\n        logging.error(f'Command validation failed: {command}')\n"
    },
    {
      "step_id": 2,
      "description": "Modify existing code to use the wrapper function",
      "action_type": "modify_file",
      "target": "main.py",
      "details": "from execution_wrapper import execute_command\n\n# Example usage\ncommands = [\n    'python -m pytest tests/',\n    'python -m pip install requests'\n]\n\nfor cmd in commands:\n    execute_command(cmd)\n"
    },
    {
      "step_id": 3,
      "description": "Document the changes in README",
      "action_type": "document",
      "target": "README.md",
      "details": "## Command Execution\n\nAll command executions are now wrapped in a validation step to ensure they pass through `validate_plan` before execution. This is handled by the `execute_command` function in `execution_wrapper.py`. Logs are generated to confirm validation and execution steps.\n"
    }
  ]
}