{
  "task_id": "task-153169AE",
  "created_at": "2026-04-15T19:14:00Z",
  "branch_name": "task/task-153169AE/update-planner-to-use-real-executable-commands",
  "estimated_complexity": "medium",
  "notes": "Ensure that all commands are verified to be executable in the current environment. If a command cannot be executed, it should be omitted rather than replaced with a placeholder.",
  "steps": [
    {
      "step_id": 1,
      "description": "Identify all run_command steps in the planner",
      "action_type": "research",
      "target": "planner codebase",
      "details": "Review the planner's codebase to locate all instances where 'run_command' steps are defined. Focus on identifying steps that use placeholder commands for verification."
    },
    {
      "step_id": 2,
      "description": "Replace placeholder commands with real executable commands",
      "action_type": "modify_file",
      "target": "path/to/planner_code_file.ext",
      "details": "For each identified placeholder command, determine if there is a real executable command that can be used instead. Modify the code to replace the placeholder with the real command. Ensure that the command is executable via CLI or Python entry point."
    },
    {
      "step_id": 3,
      "description": "Remove verification steps that cannot be replaced",
      "action_type": "modify_file",
      "target": "path/to/planner_code_file.ext",
      "details": "For any verification steps that cannot be replaced with a real executable command, remove the step entirely from the planner's code. Ensure that the removal does not affect the overall functionality of the planner."
    },
    {
      "step_id": 4,
      "description": "Test the updated planner",
      "action_type": "run_command",
      "target": "command to test planner functionality",
      "details": "Execute the planner using its CLI or Python entry point to ensure that all changes have been correctly implemented and that the planner functions as expected without any placeholder commands."
    }
  ]
}